{
  "attempt_binding": {
    "attempt_id_rule": "the replay gate mints exactly one attempt id of the form gen2-<executable_code_commit[:12]>-<utc>; the model pilot consumes that same attempt id, writes under exactly that Blob prefix and refuses any receipt minted for a different attempt",
    "one_replay_attempt_authorizes_at_most_one_model_pilot": true
  },
  "authorities": [
    {
      "bytes": 19632,
      "path": "studies/study3/prompts/study3_v0_6_p0_r1_authority.md",
      "role": "the operative P0-R1 scientific and operational boundary",
      "sha256": "f72292e75ebf128e90c5cd73588786afa11d9f156f37392a9a9200845ddc19d2"
    },
    {
      "bytes": 23486,
      "path": "studies/study3/prompts/study3_p0_r1_pre_replay_execution_completion_authority_rev2.md",
      "role": "the model-free execution-completion supplement; it corrects pre-replay implementation and sequencing defects and changes no scoring rule, corpus, allocation, cap or claim boundary",
      "sha256": "ffe75ba42c023e959f3beb23927604c3ae72c07fb4b25be346f504c8ea2930de"
    },
    {
      "bytes": 30706,
      "path": "studies/study3/prompts/study3_p0_r1_post_ready_transport_exception_safety_authority.md",
      "role": "the model-free post-ready transport, runtime-binding, durable partial-result and exception-safety completion authority; it changes no scoring rule, corpus, allocation, cap, model or tokenizer identity, rendering, parser, statistic, claim boundary, role meaning, smoke criterion or terminal-state meaning",
      "sha256": "5594e9728e8e4eb14635c34fb4895e65f2a8fa152ff2bffe76aec33a3ea84d18"
    }
  ],
  "caps": {
    "additional_gpu_attempt_with_signed_zero_operation_receipt": 1,
    "bank_rows_written": 0,
    "distinct_checkpoint_identities_downloaded": 3,
    "distinct_tokenizer_identities_constructed": 3,
    "gpu_jobs_performing_a_model_operation": 1,
    "hosted_provider_inference_calls": 0,
    "model_weight_loads": 3,
    "non_generative_prefill_evaluations": 180,
    "positive_reference_operations": 0,
    "s1_scored_rows": 162,
    "s2_scored_rows": 18,
    "s3_cpu_only_reuse_scored_rows": 18,
    "s4_generation_calls": 12,
    "s4_incremental_decode_evaluations": 36,
    "s4_prefill_evaluations": 12,
    "s4_scored_generation_rows": 12,
    "seeds_drawn": 0,
    "tokenizer_encoded_sequences": 10000,
    "total_scored_rows": 210,
    "total_sequence_level_model_evaluation_equivalents": 228
  },
  "claim_boundary": "a methods-feasibility continuation. It selects no interface, sets no threshold, passes no formal gate, answers no research question, resolves neither OD2 nor UR-22, freezes nothing and produces no evidence-ledger row.",
  "corpus_and_p0_t": [
    {
      "bytes": 69781,
      "path": "studies/study3/pilot/p0/corpus/p0_corpus.json",
      "role": "the frozen 35-cell / 70-member P0 corpus",
      "sha256": "5343019a334ce666bb3e7f7f57d87181550aa90fad4815ba51a7ba3f571e1c6c"
    },
    {
      "bytes": 7850,
      "path": "studies/study3/pilot/p0/results/p0-t/P0_T_DISPOSITION.md",
      "role": "the published P0-T disposition",
      "sha256": "9d6a6508383ebd5f6e4f0bb97a5b75de282da3cf28afba837b923cd1a6ec66eb"
    },
    {
      "bytes": 7934,
      "path": "studies/study3/pilot/p0/results/p0-t/p0_tokenizer_gate_receipt.json",
      "role": "the published P0-T receipt",
      "sha256": "0b28fbe6f633cc5a6d0664588fb685065d15ab1c301a1540d1e12f7c7b69e737"
    },
    {
      "bytes": 5820022,
      "path": "studies/study3/pilot/p0/results/p0-t/p0_tokenizer_gate_result.json",
      "role": "the published P0-T tokenizer gate result",
      "sha256": "9603b61165bc0b405fe8eb6103a56e646ceb2e254a33e0eba2ee2d035f03a85f"
    }
  ],
  "counters_before_execution": {
    "additional_gpu_attempt_with_signed_zero_operation_receipt": 0,
    "bank_rows_written": 0,
    "common_prefix_tokens_processed": 0,
    "distinct_checkpoint_identities_downloaded": 0,
    "distinct_tokenizer_identities_constructed": 0,
    "exceptions_observed": 0,
    "generated_tokens": 0,
    "gpu_jobs_performing_a_model_operation": 0,
    "hosted_provider_inference_calls": 0,
    "model_weight_loads": 0,
    "non_generative_prefill_evaluations": 0,
    "parser_calls": 0,
    "positive_reference_operations": 0,
    "registered_prompt_tokens_processed": 0,
    "replay_gate_evaluations": 0,
    "restricted_logit_reads": 0,
    "runtime_batched_forward_calls": 0,
    "runtime_batched_tokenizer_calls": 0,
    "s1_scored_rows": 0,
    "s2_scored_rows": 0,
    "s3_cpu_only_reuse_scored_rows": 0,
    "s4_generation_calls": 0,
    "s4_incremental_decode_evaluations": 0,
    "s4_prefill_evaluations": 0,
    "s4_scored_generation_rows": 0,
    "scoring_context_tokens_processed": 0,
    "seeds_drawn": 0,
    "tokenizer_construction_events": 0,
    "tokenizer_encoded_sequences": 0,
    "total_scored_rows": 0,
    "total_sequence_level_model_evaluation_equivalents": 0
  },
  "dependency_lock": {
    "durable_transport": {
      "bytes": 1779,
      "path": "studies/study3/pilot/p0_r1/container/requirements-study3-p0-r1-transport-v2.txt",
      "sha256": "e53ed34b97c83285fc7a738b573a08f9155e66ff909ead5de9f762d94745aea9"
    },
    "frozen_science": {
      "bytes": 790,
      "path": "studies/study3/pilot/p0_r1/container/requirements-study3-p0-r1.txt",
      "sha256": "a33a66e11ad104b0c402e6decc70f62d1941580c4ea46c1b56f0c023849d2fd8"
    },
    "generation_2_moves_no_frozen_science_pin": true,
    "the_build_constructs_the_real_managed_identity_client": true,
    "the_transport_closure_is_installed_under_the_science_set_as_a_constraint_file": true
  },
  "document_class": "study3_p0_r1_execution_lock",
  "executable_code": {
    "blobs": [
      {
        "bytes": 6577,
        "path": "studies/study3/pilot/p0_r1/container/Dockerfile.study3-p0-r1",
        "sha256": "3a39f1b7e6939ee77aff438524041d891bd5ae4bf09b9e4e4ea437e89a26b324"
      },
      {
        "bytes": 10413,
        "path": "studies/study3/pilot/p0_r1/container/Dockerfile.study3-p0-r1-v2",
        "sha256": "2e3703ea3c8fc8373e8f9a470137c7e32314361c5a0c8977ced579fe2d1d1abe"
      },
      {
        "bytes": 1883,
        "path": "studies/study3/pilot/p0_r1/container/p0_r1_acr_task.yaml",
        "sha256": "5594284e8be22b31786ca7cdfd2b66d244b24fcd30c67dd486f3708c5cec2081"
      },
      {
        "bytes": 2288,
        "path": "studies/study3/pilot/p0_r1/container/p0_r1_acr_task_v2.yaml",
        "sha256": "a89a259b530aa56d3ef0cd63023bb707947e2466a7ff618694f0068942b51867"
      },
      {
        "bytes": 1472,
        "path": "studies/study3/pilot/p0_r1/container/p0_r1_checkout.sh",
        "sha256": "9c3abed6e3cd2cd19b389c0b438b073f5ae1ea54f7af4acc14b94bbcebd5643b"
      },
      {
        "bytes": 3143,
        "path": "studies/study3/pilot/p0_r1/container/p0_r1_gpu_job.yaml",
        "sha256": "7a04e957b25a6ad090b7d4da92f8506f126f0c4a7390bd37e5d44480d36edd4f"
      },
      {
        "bytes": 5008,
        "path": "studies/study3/pilot/p0_r1/container/p0_r1_gpu_job_v2.yaml",
        "sha256": "b82d0d7b2e604f5929b18121ce156c45877cae07e4ecb04819493d22f55d0b9c"
      },
      {
        "bytes": 2905,
        "path": "studies/study3/pilot/p0_r1/container/p0_r1_image_manifest.py",
        "sha256": "4dec7de4a317c1d220110829644b32d9270ee819f3d08874717b412f442a39b4"
      },
      {
        "bytes": 6784,
        "path": "studies/study3/pilot/p0_r1/container/p0_r1_image_manifest_v2.py",
        "sha256": "ca04e402b7847754ebcbee3986fceab6fc3f3ff32f060c918f3670808b2b3f4b"
      },
      {
        "bytes": 3594,
        "path": "studies/study3/pilot/p0_r1/container/p0_r1_launch_gpu_pilot.sh",
        "sha256": "260429387ee95b1ea7ae362f4da7b07b51b23e3c5c2b58e565051e17d5055668"
      },
      {
        "bytes": 5914,
        "path": "studies/study3/pilot/p0_r1/container/p0_r1_launch_gpu_pilot_v2.sh",
        "sha256": "b173a94dcc2f541a3e944eca09249222e4003dcf6fc96687124539b7aff01cb2"
      },
      {
        "bytes": 2462,
        "path": "studies/study3/pilot/p0_r1/container/p0_r1_model_pilot.sh",
        "sha256": "82aca125898d3232cb2de71cb2c72af8bf8caedc608272f6def564da5f14a7c0"
      },
      {
        "bytes": 4442,
        "path": "studies/study3/pilot/p0_r1/container/p0_r1_model_pilot_v2.sh",
        "sha256": "98ca42c0b06a55ebdd5e61cf80a9f181996baf71d0bc422b06f7e76d91dac1a0"
      },
      {
        "bytes": 1554,
        "path": "studies/study3/pilot/p0_r1/container/p0_r1_no_accelerator_probe.py",
        "sha256": "c300ef13736f1d950a0bfdd5b37bd95ba7bc21bb115f59b13dda2a00b5161b14"
      },
      {
        "bytes": 2672,
        "path": "studies/study3/pilot/p0_r1/container/p0_r1_prestart_guard.py",
        "sha256": "1da8da02201770151b8f74cb439832ebad19db2327f1c1fc90677b186203068e"
      },
      {
        "bytes": 3711,
        "path": "studies/study3/pilot/p0_r1/container/p0_r1_replay.sh",
        "sha256": "abe8095911d79773b768516701b720ab8dbe7fa15165ab01a2cadf9419514788"
      },
      {
        "bytes": 3474,
        "path": "studies/study3/pilot/p0_r1/container/p0_r1_replay_v2.sh",
        "sha256": "9bfe7838fd77eb6e6f45f5b8eb77fa95d1a95f0743d97897c912012ceaccb097"
      },
      {
        "bytes": 1521,
        "path": "studies/study3/pilot/p0_r1/container/p0_r1_require_accelerator.py",
        "sha256": "346a9de638ba7f6554dc563901e424ea60171e38c6760884039cf42ca42d3a84"
      },
      {
        "bytes": 6300,
        "path": "studies/study3/pilot/p0_r1/container/p0_r1_successor.sh",
        "sha256": "f55a0daba18e33b44ae33d465e8bdd815489de94a4d573fd2bec5505adf9bc14"
      },
      {
        "bytes": 2152,
        "path": "studies/study3/pilot/p0_r1/container/p0_r1_transport_canary_v2.sh",
        "sha256": "30f3d5553ae1c11fc00325f9defda8a970250c817d562553bb7e047a3cd86363"
      },
      {
        "bytes": 3597,
        "path": "studies/study3/pilot/p0_r1/container/p0_r1_verify_replay_receipt.py",
        "sha256": "80cec0a71e942bef50db5050c28eb108a929bfd09a6649a9cf6a59b9389c6c15"
      },
      {